{
  "$schema_version": "1.0.0",
  "colloquial_term": "adversarial robustness",
  "status": "do_not_use_bare",
  "translation_required": true,
  "resolves_to": [
    {
      "standardized_term": "adversarial_robustness",
      "when": "Used to describe resistance to crafted attacks or poisoning; co-occurs with adversarial attack, data poisoning",
      "default_for_camp": "safetyist",
      "confidence_typical": "medium"
    }
  ],
  "translation_ambiguous_when": [],
  "first_added": "2026-08-31",
  "last_reviewed": "2026-08-31"
}
