{
  "$schema_version": "1.0.0",
  "colloquial_term": "ambient surveillance",
  "status": "do_not_use_bare",
  "translation_required": true,
  "resolves_to": [
    {
      "standardized_term": "ambient_surveillance",
      "when": "Used to describe pervasive AI monitoring of people; co-occurs with camera surveillance, mass surveillance",
      "default_for_camp": "skeptic",
      "confidence_typical": "medium"
    }
  ],
  "translation_ambiguous_when": [],
  "first_added": "2026-08-31",
  "last_reviewed": "2026-08-31"
}
